inn	code	product	weight	package	organisation	adress	phone	email
2309146048	4651118240084	Сок яблочно-виноградный прямого отжима «Гросбахер»	3 л	Бэг ин Бокс (Bag-in-Box)	ООО «Гросбахер»	350004, Краснодарский край, г. Краснодар, ул. им. Кропоткина, д. 50, пом. 76	7(861) 262-47-50	big.beer2015@yandex.ru
2312294060	4651117718225	-	-	-	ООО «ПРЕМИУМ ПРОДУКТ»	350059, Краснодарский край, г. Краснодар, 4-Й Тихорецкий проезд, д. 5/2, офис 2	7(915) 050-33-11	ando12005@mail.ru
230201075508	4651115932999	«К чаю»Кулич «Воскресная роза»	2,5 кг	Гофра короб	ИП Прокопенко Людмила Ивановна	352900, Краснодарский крайг. Армавир, с/т «Восход» отделение №1, уч. 110	7(918)  650-53-33	snab-sofia@mail.ru
231128449244	4651113800054	Арахисовая паста «CHOKOLATE»	300 мл	Стеклянная банка	ИП Васильева Елена Алексеевна	350000, Краснодарский край, г. Краснодар, пр-д 1 Звенигородский, д. 7	7(961) 970-90-29, 7(918) 250-80-09	belevcova@yandex.ru
2312158090	7952361412431	SG Шуруп 5,0х 20 Белый Цинк	0,6 кг.	Картон	ООО «ЮгМеталлСбыт»	350059, Россия, г. Краснодар, ул. Новороссийская, 220/Е	7(861) 234-49-10 	info@yugmetizcom.ru
56107432398	4651114460936	Мука 	2 кг		ИП Габибуллаев Мурад Магомедзагирович	367013, Р. Дагестан, г. Махачкала, ул. Нахимова, д. 13 «В», кв. 26	7(928) 838-84-84	lekistroy@mail.ru
23210329001	4651117640229	Продукт мясной из свинины бескостный сыровяленый ломтики «по-Терновски. Острые»	0,2 кг	Пластиковый пакет ПЕТ/ПЕ, газомодифицированная среда	ИП Михеенко Николай Андреевич	352125, Краснодарский край, г. Тихорецк, ул. Гоголя, д. 44 В, кв. 88 	7(988) 248-01-08 	freekrd@mail.ru
231118777334	4651116390262	Мусорный мешок «Премиум с завязками» синий 15шт	35 литров	Пленка	ИП Евтушенко Константин Александрович 	350047, Краснодарский край, г. Краснодар, проезд Труда, 27/2	7(962) 879-60-10 	com-99@mail.ru
